<dataset xmlns:xsi="http://www.w3.org/2001/XMLSchema-instance"
	xmlns="http://digitalhps.org/lerna-Dataset-model" xsi:schemaLocation="http://digitalhps.org/lerna-Dataset-model dataset-schema.xsd">
	<datasetType>kk</datasetType>
	<databaseList>
		<database>1</database>
		<database>20</database>
	</databaseList>
	<nodeList>
		<node>
			<id>1</id>
			<label>Person</label>
			<propertyList>
				<property>
					<name>Name</name>
					<value>Karan</value>
				</property>
			</propertyList>
		</node>
		<node>
			<id>2</id>
			<label>Institute</label>
			<propertyList>
				<property>
					<name>University</name>
					<value>ASU</value>
				</property>
			</propertyList>
		</node>
	</nodeList>
	<relationList>
		<relation>
			<id>1</id>
			<type>affiliatedWith</type>
			<propertyList>
				<property>
					<name>Year</name>
					<value>2013</value>
				</property>
			</propertyList>
			<startNode>1</startNode>
			<endNode>2</endNode>
		</relation>
	</relationList>
</dataset>